{"schema_version":1,"case_id":"echo-control","operation":"overhead calibration: one empty-kernel call (echo) on the option request records, per request; the caller-boundary cost of each C route without pricing work",
 "sizes":{"records_per_call":13230},"frequency":"calibration only (no production call)","target":{"kind":"none","value":null,"unit":null},
 "footprint":{"cpu_ns_per_unit":{"value":null,"reason":"not measured yet: the echo rows run first in a later task (T22, B13-echo)"},
  "wall_ns_per_unit":{"value":null,"reason":"not measured yet: the echo rows run first in a later task (T22, B13-echo)"},
  "ready_state_bytes":{"value":null,"reason":"not measured yet: the echo rows run first in a later task (T22, B13-echo)"},
  "group_peak_bytes":{"value":null,"reason":"not measured yet: the echo rows run first in a later task (T22, B13-echo)"}},
 "breakdown":{"computation":{"share":0,"uncertainty":"an empty kernel: no pricing work"},
  "allocation":{"share":null,"uncertainty":"not separated"},"serialization":{"share":null,"uncertainty":"the request packing and the record decoding are the measured part"},
  "database":{"share":0,"uncertainty":"no database in the case"},"io_wait":{"share":null,"uncertainty":"pipe and region transfer to pl-worker is the measured part"},
  "lock_contention":{"share":null,"uncertainty":"no pool rows exist (single-threaded rows only)"},"queueing":{"share":null,"uncertainty":"no pool rows exist (single-threaded rows only)"}},
 "python_options":[],
 "approval":{"state":"APPROVED","reference":"ex-option-T19 (artifacts/approvals/ex-option-T19/verdict.md, APPROVE at 1dcb3ba; new record of T19 EX-10, ruling R43 item f; recorded by R23)","baseline_variant":"py-reference"},
 "operational_costs":{"transport":"C routes stdio (pl-worker, bounded validated frames over pipes) and shm (memfd regions, validated control frames); no inproc echo (libpl_inproc.so has no echo mode)",
  "deployment_artifacts":"none: a calibration case of the bench only; pl-worker is the same binary as for option-chain-greeks",
  "observability":"bench evidence only (per-row cgroup CPU, route label, raw blocks)",
  "failure_handling":"a failed echo call fails its row in evidence; nothing falls back to another route",
  "retries_idempotency":"an echo request has no state, so a repeat is idempotent; the bench never retries a failed call",
  "ownership_abi":"the example project owns the worker protocol and its --echo option",
  "native_boundary_maintenance":"the 23 project gates, sanitizers and fuzz replay on each change of pl-worker"}}
