{"schema_version":1,"case_id":"option-chain-greeks","operation":"IV and five greeks for one selected model (each of five), per request",
 "sizes":{"records_per_call":13230},"frequency":"unknown (owner)","target":{"kind":"latency","value":200000000,"unit":"ns per request (unit-200ms-and-20pct)"},
 "footprint":{"cpu_ns_per_unit":{"value":24710203.125,"run_id":"2bb6d10ed2d9473aad9f99a953cd4224","label":"smoke-exploratory"},"wall_ns_per_unit":{"value":24726040.943359375,"run_id":"2bb6d10ed2d9473aad9f99a953cd4224","label":"smoke-exploratory"},
  "ready_state_bytes":{"value":26976256,"run_id":"2bb6d10ed2d9473aad9f99a953cd4224","label":"smoke-exploratory"},"group_peak_bytes":{"value":27590656,"run_id":"2bb6d10ed2d9473aad9f99a953cd4224","label":"smoke-exploratory"}},
 "breakdown":{"computation":{"share":null,"uncertainty":"pure computation in-process; Phase 1 profile measures it"},
  "allocation":{"share":null,"uncertainty":"not separated"},"serialization":{"share":null,"uncertainty":"JSON decoding is common setup, measured separately"},
  "database":{"share":0,"uncertainty":"no database in the case"},"io_wait":{"share":0,"uncertainty":"no network or disk in the timed call"},
  "lock_contention":{"share":null,"uncertainty":"no pool rows exist (single-threaded rows only)"},"queueing":{"share":null,"uncertainty":"no pool rows exist (single-threaded rows only)"}},
 "python_options":[{"name":"vectorization (py-optimized)","state":"measured","run_id":"2bb6d10ed2d9473aad9f99a953cd4224"},
  {"name":"Newton IV with analytic vega for BSM","state":"proposed","run_id":null},
  {"name":"seed the American brackets with the BSM IV","state":"proposed","run_id":null},{"name":"fewer CRR steps (a change of the protected CRR definition, not an alternative under it)","state":"proposed","run_id":null},
  {"name":"reuse results across chain refreshes when quotes are unchanged","state":"proposed","run_id":null},
  {"name":"`fastScheme` for ALO (a definition change under `alo_scheme`, not an alternative under it)","state":"proposed","run_id":null}],
 "approval":{"state":"APPROVED","reference":"perf-lab-t14-decide (approved record sha256 542dc08072cc13264ffb21399aab8ed1218a9737c5ba376f434b0b671b9d0a3d); changed by the owner rules C15 and FR5 item 9 and by EX-3 (policy name); re-approved by ex-option-T10 (APPROVE at 1f4fcf8, source identity a51642a5)","baseline_variant":"py-reference"},
 "operational_costs":{"transport":"Phase 2 C routes stdio (pl-worker, bounded validated frames over pipes), shm (memfd regions, validated control frames) and inproc (libpl_inproc.so in the interpreter, least safe); each row keeps its route label",
  "deployment_artifacts":"pl-kernel, pl-worker and libpl_inproc.so built by the project check with the pinned toolchain, plus the Python codec; none ships by default",
  "observability":"bench evidence only (per-row cgroup CPU, group peak, route label, raw blocks); no production telemetry exists for the C path",
  "failure_handling":"a C failure, refusal or call deadline fails or blocks the row in evidence; a production fallback to Python is not designed yet",
  "retries_idempotency":"a request is a pure computation over its input, so a repeat is idempotent; the bench never retries a failed call",
  "ownership_abi":"the example project owns the worker protocol and the in-process ABI; a production owner is not assigned (owner)",
  "native_boundary_maintenance":"the 23 project gates, sanitizers and fuzz replay on each change; the C models must track the Python reference, the oracle and the locked tolerances"}}
